{"agent_assessments":[{"agent_name":"synthetic-agent","assessment_ref":"synthetic:assessment-1","basis":"Snippet does not establish the site","model_reported":null,"model_requested":"synthetic-model","model_unreported_reason":"Provider omitted model identifier","outcome":"unclear","subject_ref":"synthetic:claim-1"}],"candidate_links":[{"basis":"Address correspondence only","candidate_ref":"synthetic:candidate-1","disposition":"possible","osm_ref":"way/123","project_site_id":null}],"case_ref":"synthetic:case-1","claims":[{"attribute":"worship","claim_ref":"synthetic:claim-1","described_date":"2019","geometry":null,"observation_date":"2020","source_refs":["synthetic:source-1"],"uncertainty":"Address only; location unresolved","wording":"A synthetic meeting is mentioned"}],"context":{"evidence_version_hash":null,"task_id":null},"country_code":"bs","definition_hash":"aaaaaaaaaaaaaaaaaaaaaaaaaaaaaaaaaaaaaaaaaaaaaaaaaaaaaaaaaaaaaaaa","definition_version":"0.1.6","disposition":"provisional","parents":[],"schema_version":"inspection-case.v1","source_snapshot_date":"2026-09-01","sources":[{"access_result":"snippet_only","copy_permission":"needs_review","display_permission":"needs_review","extract":null,"licence_note":"Permission pending","locator":"https://example.org/directory","original_hash":null,"publication_date":"2020","publisher":"Synthetic directory","retrieved_at":"2026-09-01T12:00:00Z","returned_date":null,"source_family_ref":"synthetic:family-1","source_ref":"synthetic:source-1"}]}
